"","category","over_represented_pvalue","under_represented_pvalue","numDEInCat","numInCat","term","ontology"
"346","GO:1904638",0.0231990754089256,1,1,1,"response to resveratrol","BP"
"347","GO:1904644",0.0231990754089256,1,1,1,"cellular response to curcumin","BP"
"348","GO:1904645",0.0427878726739444,0.999534417859254,1,2,"response to amyloid-beta","BP"
"349","GO:1904648",0.0231990754089256,1,1,1,"cellular response to rotenone","BP"
"350","GO:1904872",0.0423880970743349,0.999543172061572,1,2,"regulation of telomerase RNA localization to Cajal body","BP"
"351","GO:1904893",0.0261977708110464,1,1,1,"negative regulation of receptor signaling pathway via STAT","BP"
"352","GO:1905246",0.0214089201446791,1,1,1,"negative regulation of aspartic-type peptidase activity","BP"
"353","GO:1905776",0.0253413517007199,1,1,1,"positive regulation of DNA helicase activity","BP"
"355","GO:1990417",0.0232872713646177,1,1,1,"snoRNA release from pre-rRNA","BP"
"357","GO:2000110",0.0214089201446791,1,1,1,"negative regulation of macrophage apoptotic process","BP"
"358","GO:2000111",0.0231990754089256,1,1,1,"positive regulation of macrophage apoptotic process","BP"
"359","GO:2000363",0.0214089201446791,1,1,1,"positive regulation of prostaglandin-E synthase activity","BP"
"360","GO:2000481",0.0231990754089256,1,1,1,"positive regulation of cAMP-dependent protein kinase activity","BP"
"361","GO:2000614",0.0231990754089256,1,1,1,"positive regulation of thyroid-stimulating hormone secretion","BP"
"362","GO:2000619",0.04517781431286,0.999480309684511,1,2,"negative regulation of histone H4-K16 acetylation","BP"
"363","GO:2000655",0.0231990754089256,1,1,1,"negative regulation of cellular response to testosterone stimulus","BP"
"364","GO:2000697",0.0214092421271054,1,1,1,"negative regulation of epithelial cell differentiation involved in kidney development","BP"
"365","GO:2000774",0.0231990754089256,1,1,1,"positive regulation of cellular senescence","BP"
"366","GO:2001161",0.0214146650641262,1,1,1,"negative regulation of histone H3-K79 methylation","BP"
